{
  "control_id": "CC7.1",
  "collection_timestamp": "2026-06-17T15:00:49Z",
  "status": "green",
  "metrics": {
    "active_trails": 3,
    "log_coverage_percent": 97.5,
    "max_gap_hours": 0,
    "critical_control_failures_30d": 0,
    "config_recorder_all_supported": true,
    "cui_events_captured": 2,
    "cui_retention_days": 365
  },
  "evidence_artifacts": [
    "log_completeness.json",
    "cui_events_export.json"
  ],
  "findings": [],
  "notes": "Log completeness, CUI-relevant events, and DFARS 7012 detection evidence.",
  "provider": "mock",
  "cui_scoped": true,
  "attck_tags": [
    "T1078",
    "T1005",
    "T1087"
  ]
}