{
  "control_id": "CC6.1",
  "collection_timestamp": "2026-06-17T15:00:49Z",
  "status": "green",
  "metrics": {
    "total_identities": 147,
    "orphaned_accounts": 2,
    "privileged_count": 8,
    "privileged_standing_count": 8,
    "days_since_last_review": 45,
    "session_timeout_compliant": true,
    "jit_recommendations_count": 2
  },
  "evidence_artifacts": [
    "iam_users_export.csv",
    "jit_recommendations.json"
  ],
  "findings": [
    {
      "resource": "bob",
      "issue": "orphaned account (>90d inactive)",
      "severity": "medium"
    }
  ],
  "notes": "IAM access review with JIT privileged access recommendations.",
  "provider": "mock",
  "composite_checks": {
    "jit_recommendations": [
      "Convert admin-breakglass to 4-hour JIT elevation with approval workflow",
      "Remove unused access keys for service account svc-backup"
    ]
  }
}