{
  "control_id": "C1.4",
  "collection_timestamp": "2026-06-17T15:00:49Z",
  "status": "green",
  "metrics": {
    "objects_past_retention": 0,
    "retention_policy_cutoff": "2026-03-17T00:00:00Z"
  },
  "evidence_artifacts": [
    "retention_report.json"
  ],
  "findings": [],
  "notes": "Retention and secure disposal evidence for C1.4.",
  "provider": "mock"
}